{
  "documento_curricular": [
    {
      "id": "bncc-2018",
      "nome": "Base Nacional Comum Curricular",
      "tipo": "base_nacional",
      "esfera": "federal",
      "derivado_de": null
    },
    {
      "id": "computacao-2022",
      "nome": "Computação na Educação Básica (complemento à BNCC)",
      "tipo": "complemento",
      "esfera": "federal",
      "derivado_de": "bncc-2018"
    }
  ],
  "etapas": [
    {
      "id": "EI",
      "nome": "Educação Infantil"
    },
    {
      "id": "EF",
      "nome": "Ensino Fundamental"
    },
    {
      "id": "EM",
      "nome": "Ensino Médio"
    }
  ],
  "modalidades": [
    {
      "id": "eja",
      "nome": "Educação de Jovens e Adultos",
      "transversal_a": [
        "EF",
        "EM"
      ],
      "segmentos": [
        {
          "id": "eja-1",
          "corresponde_a": "EF anos iniciais"
        },
        {
          "id": "eja-2",
          "corresponde_a": "EF anos finais"
        },
        {
          "id": "eja-3",
          "corresponde_a": "EM"
        }
      ]
    }
  ],
  "areas_conhecimento": [
    {
      "id": "ef-area-linguagens",
      "etapa": "EF",
      "nome": "Linguagens",
      "documento": "bncc-2018"
    },
    {
      "id": "ef-area-matematica",
      "etapa": "EF",
      "nome": "Matemática",
      "documento": "bncc-2018"
    },
    {
      "id": "ef-area-ciencias-da-natureza",
      "etapa": "EF",
      "nome": "Ciências da Natureza",
      "documento": "bncc-2018"
    },
    {
      "id": "ef-area-ciencias-humanas",
      "etapa": "EF",
      "nome": "Ciências Humanas",
      "documento": "bncc-2018"
    },
    {
      "id": "ef-area-ensino-religioso",
      "etapa": "EF",
      "nome": "Ensino Religioso",
      "documento": "bncc-2018"
    },
    {
      "id": "em-area-lgg",
      "etapa": "EM",
      "nome": "Linguagens e suas Tecnologias",
      "documento": "bncc-2018"
    },
    {
      "id": "em-area-mat",
      "etapa": "EM",
      "nome": "Matemática e suas Tecnologias",
      "documento": "bncc-2018"
    },
    {
      "id": "em-area-cnt",
      "etapa": "EM",
      "nome": "Ciências da Natureza e suas Tecnologias",
      "documento": "bncc-2018"
    },
    {
      "id": "em-area-chs",
      "etapa": "EM",
      "nome": "Ciências Humanas e Sociais Aplicadas",
      "documento": "bncc-2018"
    }
  ],
  "componentes_curriculares": [
    {
      "id": "ef-comp-ar",
      "etapa": "EF",
      "nome": "Arte",
      "sigla_codigo": "AR",
      "area": "ef-area-linguagens",
      "tem_aprendizagens_proprias": true,
      "presenca": {
        "anos": [
          1,
          2,
          3,
          4,
          5,
          6,
          7,
          8,
          9
        ]
      }
    },
    {
      "id": "ef-comp-ci",
      "etapa": "EF",
      "nome": "Ciências",
      "sigla_codigo": "CI",
      "area": "ef-area-ciencias-da-natureza",
      "tem_aprendizagens_proprias": true,
      "presenca": {
        "anos": [
          1,
          2,
          3,
          4,
          5,
          6,
          7,
          8,
          9
        ]
      }
    },
    {
      "id": "ef-comp-ef",
      "etapa": "EF",
      "nome": "Educação Física",
      "sigla_codigo": "EF",
      "area": "ef-area-linguagens",
      "tem_aprendizagens_proprias": true,
      "presenca": {
        "anos": [
          1,
          2,
          3,
          4,
          5,
          6,
          7,
          8,
          9
        ]
      }
    },
    {
      "id": "ef-comp-er",
      "etapa": "EF",
      "nome": "Ensino Religioso",
      "sigla_codigo": "ER",
      "area": "ef-area-ensino-religioso",
      "tem_aprendizagens_proprias": true,
      "presenca": {
        "anos": [
          1,
          2,
          3,
          4,
          5,
          6,
          7,
          8,
          9
        ]
      }
    },
    {
      "id": "ef-comp-ge",
      "etapa": "EF",
      "nome": "Geografia",
      "sigla_codigo": "GE",
      "area": "ef-area-ciencias-humanas",
      "tem_aprendizagens_proprias": true,
      "presenca": {
        "anos": [
          1,
          2,
          3,
          4,
          5,
          6,
          7,
          8,
          9
        ]
      }
    },
    {
      "id": "ef-comp-hi",
      "etapa": "EF",
      "nome": "História",
      "sigla_codigo": "HI",
      "area": "ef-area-ciencias-humanas",
      "tem_aprendizagens_proprias": true,
      "presenca": {
        "anos": [
          1,
          2,
          3,
          4,
          5,
          6,
          7,
          8,
          9
        ]
      }
    },
    {
      "id": "ef-comp-li",
      "etapa": "EF",
      "nome": "Língua Inglesa",
      "sigla_codigo": "LI",
      "area": "ef-area-linguagens",
      "tem_aprendizagens_proprias": true,
      "presenca": {
        "anos": [
          6,
          7,
          8,
          9
        ]
      }
    },
    {
      "id": "ef-comp-lp",
      "etapa": "EF",
      "nome": "Língua Portuguesa",
      "sigla_codigo": "LP",
      "area": "ef-area-linguagens",
      "tem_aprendizagens_proprias": true,
      "presenca": {
        "anos": [
          1,
          2,
          3,
          4,
          5,
          6,
          7,
          8,
          9
        ]
      }
    },
    {
      "id": "ef-comp-ma",
      "etapa": "EF",
      "nome": "Matemática",
      "sigla_codigo": "MA",
      "area": "ef-area-matematica",
      "tem_aprendizagens_proprias": true,
      "presenca": {
        "anos": [
          1,
          2,
          3,
          4,
          5,
          6,
          7,
          8,
          9
        ]
      }
    },
    {
      "id": "em-comp-lp",
      "etapa": "EM",
      "nome": "Língua Portuguesa",
      "sigla_codigo": "LP",
      "area": "em-area-lgg",
      "tem_aprendizagens_proprias": true,
      "destaque_legal": "Lei nº 13.415/2017"
    },
    {
      "id": "em-comp-mat",
      "etapa": "EM",
      "nome": "Matemática",
      "sigla_codigo": null,
      "area": "em-area-mat",
      "tem_aprendizagens_proprias": true,
      "destaque_legal": "Lei nº 13.415/2017",
      "nota": "detalhamento coincide com a área (componente único)"
    },
    {
      "id": "em-comp-arte",
      "etapa": "EM",
      "nome": "Arte",
      "sigla_codigo": null,
      "area": "em-area-lgg",
      "tem_aprendizagens_proprias": false,
      "fonte": {
        "documento": "bncc-2018",
        "arquivo": "Base-Nacional-Comum-Curricular-BNCC.pdf",
        "proveniencia": "BNCC completa homologada (600 p.), obtida em 09/07/2026",
        "localizador": "página PDF 35",
        "localizador_pdf": "Base-Nacional-Comum-Curricular-BNCC.pdf, página PDF 35"
      }
    },
    {
      "id": "em-comp-educacao-fisica",
      "etapa": "EM",
      "nome": "Educação Física",
      "sigla_codigo": null,
      "area": "em-area-lgg",
      "tem_aprendizagens_proprias": false,
      "fonte": {
        "documento": "bncc-2018",
        "arquivo": "Base-Nacional-Comum-Curricular-BNCC.pdf",
        "proveniencia": "BNCC completa homologada (600 p.), obtida em 09/07/2026",
        "localizador": "página PDF 35",
        "localizador_pdf": "Base-Nacional-Comum-Curricular-BNCC.pdf, página PDF 35"
      }
    },
    {
      "id": "em-comp-lingua-inglesa",
      "etapa": "EM",
      "nome": "Língua Inglesa",
      "sigla_codigo": null,
      "area": "em-area-lgg",
      "tem_aprendizagens_proprias": false,
      "fonte": {
        "documento": "bncc-2018",
        "arquivo": "Base-Nacional-Comum-Curricular-BNCC.pdf",
        "proveniencia": "BNCC completa homologada (600 p.), obtida em 09/07/2026",
        "localizador": "página PDF 35",
        "localizador_pdf": "Base-Nacional-Comum-Curricular-BNCC.pdf, página PDF 35"
      }
    },
    {
      "id": "em-comp-biologia",
      "etapa": "EM",
      "nome": "Biologia",
      "sigla_codigo": null,
      "area": "em-area-cnt",
      "tem_aprendizagens_proprias": false,
      "fonte": {
        "documento": "bncc-2018",
        "arquivo": "Base-Nacional-Comum-Curricular-BNCC.pdf",
        "proveniencia": "BNCC completa homologada (600 p.), obtida em 09/07/2026",
        "localizador": "página PDF 35",
        "localizador_pdf": "Base-Nacional-Comum-Curricular-BNCC.pdf, página PDF 35"
      }
    },
    {
      "id": "em-comp-fisica",
      "etapa": "EM",
      "nome": "Física",
      "sigla_codigo": null,
      "area": "em-area-cnt",
      "tem_aprendizagens_proprias": false,
      "fonte": {
        "documento": "bncc-2018",
        "arquivo": "Base-Nacional-Comum-Curricular-BNCC.pdf",
        "proveniencia": "BNCC completa homologada (600 p.), obtida em 09/07/2026",
        "localizador": "página PDF 35",
        "localizador_pdf": "Base-Nacional-Comum-Curricular-BNCC.pdf, página PDF 35"
      }
    },
    {
      "id": "em-comp-quimica",
      "etapa": "EM",
      "nome": "Química",
      "sigla_codigo": null,
      "area": "em-area-cnt",
      "tem_aprendizagens_proprias": false,
      "fonte": {
        "documento": "bncc-2018",
        "arquivo": "Base-Nacional-Comum-Curricular-BNCC.pdf",
        "proveniencia": "BNCC completa homologada (600 p.), obtida em 09/07/2026",
        "localizador": "página PDF 35",
        "localizador_pdf": "Base-Nacional-Comum-Curricular-BNCC.pdf, página PDF 35"
      }
    },
    {
      "id": "em-comp-historia",
      "etapa": "EM",
      "nome": "História",
      "sigla_codigo": null,
      "area": "em-area-chs",
      "tem_aprendizagens_proprias": false,
      "fonte": {
        "documento": "bncc-2018",
        "arquivo": "Base-Nacional-Comum-Curricular-BNCC.pdf",
        "proveniencia": "BNCC completa homologada (600 p.), obtida em 09/07/2026",
        "localizador": "página PDF 35",
        "localizador_pdf": "Base-Nacional-Comum-Curricular-BNCC.pdf, página PDF 35"
      }
    },
    {
      "id": "em-comp-geografia",
      "etapa": "EM",
      "nome": "Geografia",
      "sigla_codigo": null,
      "area": "em-area-chs",